{
  "tema": "Animais",
  "letras": ["G", "R", "T", "A", "O"],
  "enunciado": "Forme palavras com as letras disponíveis.",
  "pontuacaoMaxima": 100,
  "palavrasEscondidas": [
    {
      "palavra": "GATO",
      "dica": "Felino doméstico.",
      "tamanho": 4
    },
    {
      "palavra": "RATO",
      "dica": "Roedor.",
      "tamanho": 4
    }
  ]
}
